id,image_file,caption
I8|Alcohol 5|Two glasses of sparkling wine with gold rims and floral engraving.  They are outdoors, resting on a stump with flowers nearby and in the background.
I568|Nude woman 5|A black and white photo of a topless woman standing in a forest. She has a star in her hair and a necklace on.
I623|Picnic 4|A woman, two boys, and a man sitting on the grass. The woman's hands are together in prayer. The boys and man are wearing white turbans.
I710|Scared face 2|A man wearing a blue and white shirt in front of a green screen, with his mouth open and his eyes spread wide.
I20|Angry pose 1|A dark-haired man with his mouth wide open and his index finger pointed towards the camera.  He seems to be yelling.
I62|Beach 4|A dark-haired woman lying on a beach with her elbows resting on a log.
I33|Baby 2|A baby boy lying on his stomach and looking upwards.
I65|Beach 7|A beach with many sailboats and some swimmers in the water.  A woman's legs on a chaise longue are in the foreground.
I314|Fence 4|A chain-link fence with a strand of barbed wire.
I609|Parasailing 1|Two men kitesurfing off a tree-lined coast with mountains in the background.
I506|Mother 2|A small boy is behind a woman, holding up strands of her bright orange hair.
I613|Party 1|The arms of a woman.  She is holding a drink and has a watch on her left wrist and two rings on her right hand.  A bit of her blond hair is visible.
I337|Fireworks 4|Yellow fireworks going off in the black sky.
I398|Gorrila 1|A gorilla resting his head on one hand while touching grass with his other hand. It is sitting in a grassy enclosure with a few trees.
I381|Garbage dump 3|A pile of metal garbage. A turquoise car is in the bottom right hand corner of the image.
I300|Exercise 2|A black man lifting a barbell while five white men and one woman watch.
I69|Bear 3|A polar bear with snow on its muzzle, walking on snowy ground.
I23|Animal carcass 2|A large brown lizard eating the rotting flesh of a dead animal.
I751|Skijump 1|Four ski lifts on the side of a white snowy mountain. A parking lot is at the bottom of the mountain.
I21|Angry pose 2|A black and white picture of a person with his hands on his head, grimacing.
I179|Collaboration 1|Six hands resting on each other. One of the wrists has a purple band around it. Another one has a white watch.
I181|Cotton swabs 2|Seven cotton swabs lying on a grey surface.
I218|Dessert 1|A two-layer square cake.  It has white icing with purple dots and large purple flowers on top.
I353|Flowers 10|The feet of a man dressed in orange robes, walking on pink, red, and white flower petals.
I622|Picnic 3|A group of shirtless men sitting on wooden chairs and tables that have been placed in a stream.
I765|Sleepy pose 4|A man sleeping on a table next to a mostly empty black plastic food container and a white styrofoam drink cup.
I616|Penguins 2|An adult penguin stands upright with a baby penguin standing in front of it.  Other penguins on their bellies are in the background.
I139|Cat 10|A black and gray striped cat stretching itself.
I130|Cat 1|A black and white cat with bright blue eyes, against a shadowy background.
I106|Camping 3|Three men and two women dressed in medieval costumes sit on benches at a wooden table.  The table has a horn, a furred hat, and an apple on it.  A shield is nearby.
I147|Cemetery 2|A large, nearly full moon shines down on a howling wolf in a graveyard.  Two crosses and a headstone are visible.  A flock of birds flies overhead.
I275|Dog 25|A dog with brown and black fur lies with his chin on the ground and looks up inquiringly. A green and black rope is tied to his collar.
I224|Dessert 7|A pumpkin pie with one slice cut out sits in a basket on a table.  The missing slice is on a nearby plate.  Canned pumpkin and whole pumpkins are behind it.
I255|Dog 5|A brown and white puppy, resting its chin on a pile of toys.
I157|Children 1|A girl and a boy chasing each other for fun.
I408|Graveyard 3|Eight cross-shaped grave markers, standing in a green field with the blue sea visible in the background.
I496|Miserable pose 3|A black and white image of a severely emaciated child lying on a bed with white sheets.
I567|Nude woman 4|A black and white photo of a naked woman, lying on her side turned away from the camera. One arm is covering her breasts and the other is covering her face.
I172|Cold 2|An old-fashioned sled with curved wooden runners and red striped fabric on top, sitting in the snow.
I376|Galaxy 6|A crater-covered planet with an intense spot of light near its top.   Stars and shooting stars fill the space around it.
I5|Alcohol 2|Three shelves full of bottles of whiskey.
I393|Gazing 5|A silhouette of a man with hills behind him. The man is posing to make it look as if he has the setting sun in his hand.
I387|Gargoyle 1|A gargoyle in the form of a monster with pointy teeth and long nails.
I315|Fence 5|A chain-link fence with blue sky behind it.
I7|Alcohol 4|Many clear long-stemmed glasses with green and red liquid in them on a brown counter in front of a mirror.
I64|Beach 6|A man and woman lie side by side in a hammock suspended from two palm trees at the beach. Turquoise water, a sailboat, and hills are in the background.
I164|Cliff diver 2|A man leaps from a diving platform to begin a dive into the ocean below.
I523|Neutral face 5|A woman with shoulder-length brown hair and brown eyes looking straight into the camera.  Her hands are touching her neck.  A necklace of green beads is visible.
I216|Depressed pose 4|Profile view of a man with stubble-length hair and beard.  His head is lowered and his eyes are closed.  The fingertips of his left hand are resting on his forehead.
I469|Lake 15|A mirror-like lake reflects the sky, clouds, and trees above.  There is a patch of bright green grass on the shore.
I70|Bed 1|A bed with the covers pulled back and rumpled sheets.  At its side is a nightstand with a clock, phone, and some papers.
I388|Gargoyle 2|A gargoyle in the form of a bewigged man with an open mouth sticks out at right angles from the wall of a cathedral.
I219|Dessert 2|An array of cupcakes decorated on top with the faces of different animals.
I2|Acorns 2|Three acorns are on a flat surface.  One acorn is missing its cap.  Two caps are to the left of the acorns.  The acorns and caps are casting long shadows on the surface.
I6|Alcohol 3|Three bottles of wine with red wrapping around their necks, against a dark background.
I17|Angry face 3|A man with a shaved head.  His eyes are narrowed and his mouth is open, with the top row of teeth showing.  He is in front of a painting.
I512|Mother 8|A smiling woman and baby girl, both dressed in pink.  The baby's dress has pink wings attached to it.
I801|Storage 2|White, purple, red, green, blue, and orange shipping containers, stacked on top of each other.
I704|Sailing 1|Two women in life jackets are operating a small sailboat.  The boat is heeling sharply to the right and they are leaning to the left to balance it.
I329|Fire hydrant 1|A bright red fire hydrant surrounded by a steel bars.
I245|Doctor 4|A surgical team operating on a patient.  The surgeon is looking through a magnifying apparatus.  Five other doctors and nurses surround him.
I258|Dog 8|Three black and tan dogs lie side by side in a field of stubble.  All are staring at something to their left.  The dog in the middle has his tongue hanging out.
I833|Thunderstorm 9|A lightning storm with several streaks striking the ground.
I35|Baby 4|A man dressed in black shirts holding a new born baby.
I766|Smiling face 1|Two young girls with blond hair and dressed in identical white lace shirts, half way facing us and smiling.  They have their right and left arms crossed, touching a wood beams.
I71|Bee 1|A bee resting on the palm of a person's hand.  The bee has purple and brown wings with a yellow thorax, three legs on one side and two legs showing on the other side.
I556|Nude man 17|A bald muscular man only weary a blue underpants with "Geordi" letters written on the band.  He is staring straight and has tattoos on both arms and belly.  He is lying on a white towel with his legs spread apart.
I372|Galaxy 2|A close-up view of stars in a night sky with a large bright nebula in the center.
I588|Office supplies 3|The heads of sharpened drawing pencils arranged in a tight array.
I244|Doctor 3|A dental professional with a mask and safety glasses holding a drill in a gloved hand.
I312|Fence 2|A wrought iron fence or gate with twisted bars interspersed with twisted bulb shapes.
I458|Lake 4|A pier on a lake surrounded by mountains with a sprinkling of snow on them.
I226|Destruction 1|Helmeted construction workers standing on a damaged building in front of flags, under a threatening sky.
I728|Shark 3|An underwater view of a shark swimming with a second shark in the background.
I533|Nude couple 7|A man and a woman lying prone on top of each on a bed with their eyes closed.
I39|Baby 8|Two unclothed smiling little babies in colorful skull caps looking out from behind a blanket.
I780|Socks 1|A pair of blue and white ankle socks with the Converse logo partially visible.
I364|Frustrated pose 3|An old man with unkempt hair sinking his face into his left hand.
I756|Skydiving 2|A team of parachutists with colored flares on their feet and their hands linked to make an intertwined circular formation over a coastline below.
I807|Street 5|An empty multi-lane road running past buildings and signage and utility poles.
I745|Sidewalk 2|A grasslike plant growing in the cracks between brick shaped paving stones.
I697|Sad pose 1|A girl covering her face with her hands while sitting in front of a laptop computer.
I88|Bored pose 3|A clothes vendor resting her head on the palm of one hand with a disgusted expression on her face.
I835|Thunderstorm 11|A line of threatening clouds moving towards a fishing boat on a bay.
I384|Garbage dump 6|Rusted tins and empty bottles strewn over an area.
I272|Dog 22|A brown dog lying down with its eyes open and resting its head next to its front paw.
I307|Explosion 6|A fiery explosion above a kitchen counter outdoors on a movie set.
I483|Lion 3|A lion with eyes half closed lying with his chin on a big branch.  Green leaves are in the background.
I484|Lion 4|A lion lying on its side with its eyes closed against an enclosure wall.
I737|Shooting 1|A woman in brown with a military-style belt firing a rifle.
I819|Surgery 4|An operating room with a patient lying covered on a table with a surgeon operating and nurses assisting.
I167|Cockroach 2|A brown cockroach with spiky legs on a flat surface
I374|Galaxy 4|Streams of colorful plasma in an alien world with a circular object in the foreground and another visible in the background.
I451|KKK rally 1|Meeting of a group of Ku Klux Klan members wearing their robes and hoods.
I58|BDSM 3|Two women dressed in leather, one with bright red hair, the other black, sitting on the backs of kneeling men. The red-haired woman sits on a man in full blue leather bondage attire, with his hands chained behind his back. The other woman sits on a man dressed in black leather bondage attire with his hands tied in front of him.
I324|Fire 7|A car engulfed in flames with thick black smoke rising from it.
I770|Snake 4|A brown snaked coiled around a green snake on top of rocks and leaves.
I518|Neonazi 1|A man with a shaved head holding a black flag with white lettering, standing next to a woman holding a white sign with black lettering.
I142|Cat 13|A beige and white cat with its eyes closed.
I648|Present 2|A purple box with a light purple ribbon tied in a bow around it. In the background there are more boxes of different colors with ribbons tied around them.
I263|Dog 13|A brown and white dog, with its mouth open and teeth showing. The brown part of the dog covers only one eye.
I509|Mother 5|A brown haired woman wearing a red turtleneck sweater and black jacket holding a blonde baby wearing a grey tube knit sweater.
I658|Rafting 6|A group of people wearing red life jackets and blue and yellow helmets. They are white water rafting in a grey inflatable boat using red paddles.
I696|Sad face 9|A crying boy with his mouth open wearing a green and beige fleece hoodie.
I362|Frustrated pose 1|A dirty and damaged photograph of a woman with messy hair holding her head in her hands.
I227|Destruction 4|Metal sheeting, wood, and debris lying on the ground in front of a small house.
I626|Pigeon 1|A grey pigeon with red feet standing on green grass.
I137|Cat 8|A black cat's face with yellow eyes and white whiskers.
I448|Keyboard 2|A grey laptop keyboard with a blue L-shaped enter key.
I843|Toast 1|A group of people holding up cocktail glasses with a brown liquid inside. One of the cocktail glasses also has ice and a black straw.
I282|Dog attack 1|A man wearing a camouflage U.S. air force uniform holding the leash of a dog which is biting an object in the foreground.
I187|Couple 5|A grey and white monkey kneeling on the ground as it grooms another monkey which is lying on the ground in front of it.
I45|Bar 2|An ornately decorated lounge with blue leather chairs, turquoise track lighting, and gold counters and pillars. There are televisions with wording on them all around the room.
I133|Cat 4|The face of a ginger cat lying sideways on the floor with its eyes closed.
I409|Graveyard 4|A cemetery with rows of crooked and fallen headstones and overgrown green grass.
I72|Biking 1|A bicyclist wearing a pointed bike racing helmet and a blue and yellow biking one-piece spandex jumpsuit.
I235|Destruction 2|A fire-damaged building with one section collapsed. An American flag hangs from the building. There are disaster relief vehicles with long cranes in front of the building.
I486|Massage 1|A man massaging the torso of a woman.  The woman's eyes are closed, her hands are under her right cheek and her hair is tied in a bun.  she is relaxed and has a smile on her face.  The man has white long sleeve shirts and his hands are wrinkled.
I558|Nude man 19|A muscular shirtless man running in front of a body of water.  He has a pair of white goggles in his hand.
I795|Statue 1|A statue of the Buddha in a garden.  A bowl of purple and white flowers rests on stones in front of him.  Two candles in ornamental holders are at his sides.  Green and red trees are growing behind him.
I856|Volcano 1|A crater in some brown mountains from which white smoke is rising.
I460|Lake 6|A picnic basket and some paper cups set against a tree trunk on the edge of a lake.
I574|Nude woman 11|A young woman in a two-piece bathing suit lying on her back with her arms framing her face.
I206|Dancing 8|A group of young girls wearing ethnic dresses holding hands and dancing.
I411|Gun 1|A handgun lying on a surface with its muzzle pointing towards the viewer.
I211|Depressed face 1|A face of a woman wearing glasses and looking down with a pensive look.
I740|Shot 3|A hand holding a hypodermic syringe injecting something into a vein.
I625|Pig 2|Two large black pigs asleep in a straw-covered sty.
I437|Injury 1|The right foot of a woman exhibiting a long wound that is partially healed.
I134|Cat 5|Two very young kittens lying on a towel and peering around them.
I276|Dog 26|A mangy dog looking back with a grievous scab near its tail
I775|Snow 3|Undulating shapes on a grey sand dune in the twilight.
I629|Pigeon 4|A pigeon on a feeder eyeing two vegetables hanging in a mesh bag.
I735|Shark 10|A shark with one blue eye visible cruising by with its mouth partially open.
I299|Exercise 1|A man doing pushups on an athletic field with his head close to the grass.
I100|Building 2|Ruined walls of a church against the backdrop of white clouds a blue sky.
I699|Sad pose 3|A man sitting in an armchair with his hand covering his eyes.
I304|Explosion 3|An armed helicopter flying in front of the flames of an explosion.
I256|Dog 6|A little brown and tan puppy peering out of a polka dot cup resting on a grassy surface inside a fence.
I777|Snow 5|A mound of white snow crystals with more out of focus ones in the background.
I572|Nude woman 9|A woman in her bra and panties lying on her abdomen on a patterned sheet.
I79|Birthday 1|Six birthday candles lit and set on cupcakes. All cupcakes are chocolate colored and have blue frosting with white imitation pearls on them.
I162|Clean 1|Purple lavender soap, cream, lotion, and bath foam, in front of some sprigs of  fresh lavender.
I367|Frustrated pose 6|A woman with her eyes squeezed shut and wearing glasses, holding an object between her teeth while lifting up her long hair with her hands.
I811|Sunset 2|The sun is low on the horizon, painting the sky and clouds in vivid shades of red.
I752|Skijump 2|An empty lighted ski run at twilight with spectators watching.
I584|Nude woman 21|A woman on her abdomen propping herself up on her elbows and her lower legs pointing up clad in a revealing outfit with fishnet stockings and high heels.
I80|Birthday 2|A boy sitting with his mother at a table with a birthday cake and presents.
I668|Rocks 1|Pebbles of various colors and shapes strewn across the sand.
I471|Lake 17|A group of people enjoying a twilight outing a the edge of a lake with high rise buildings in the distant background.
I832|Thunderstorm 8|A bolt of lightning against a blue sky and scattered clouds.
I200|Dancing 2|A ballerina doing a pirouette with the raised leg extended straight out.
I566|Nude woman 3|A naked woman lying on her back on a bed with one arm behind her head and the other hand near her upper thighs.
I711|Scared face 3|A sinister looking face of a woman looking up with her brown eyes and clenched fists covering her nose and mouth.
I896|Yoga 2|A man wearing only shorts doing a yoga pose on a sandy beach.
I81|Birthday 3|A table setting for a birthday party with glasses, plates and caps and sparkly things around a multi-level tray holding desserts.
I705|Sailing 2|A sailor in a harness hiking out of a sailboat on a reach.
I123|Car race 1|A group of colorful race cars going around a curve on a race track
I396|Goat 1|A long-haired goat sitting on the ground with its eyes closed and its head held up.
I202|Dancing 4|A couple dancing the tango.  She wears an ankle length skirt with bright pink streamers.
I85|Bored face 1|A man with a close up image of his face is wearing glasses and looking pensive.  He is wearing prescription glasses and has the reflection of a computer screen on his right lens.
I576|Nude woman 13|A woman wearing a red bikini lying on sand.  She has three strands of pearls around her neck and blue eye shadow and mascara.  Her eyes ae closed and she has a relaxed expression.  Her bikini bra shows half of her full size breast.
I732|Shark 7|A white and blue shark under the surface of blue water with a pilot fish under it.
I92|Bottle 1|Three plastic  bottles of water with blue caps laid flat on a white surface, one in the center and the other two are at an angle.
I308|Father 1|A man asleep with a sleeping little baby lying on him just beside and below his right cheek.
I602|Paperclips 3|A bunch of paper clips that have been interlaced together.
I706|Sailing 3|A red sailboat on a lake in the evening sun with high rise buildings and a tower in the background. The sunlight reflects off the buildings on to the water.
I395|Gazing 7|A man sitting cross-legged on a wall looking across the water towards a large city with high rise buildings in the background.
I391|Gazing 3|A young child gazing at something with his right hand in his mouth.
I497|Miserable pose 4|A girl with her head tilted down in a sad way sitting on a bed with wet hair and a towel across her torso.
I203|Dancing 5|An old couple dancing, the woman is smiling, looks down  and has her head close to him.  The brim of the man's hat is coming over her hair, he is wearing a scarf and is looking forward.
I125|Car race 3|A group of colorful race cars going around a curve in a single line on a race track.
I118|Car accident 3|Pieces of glass from the right front side of a car shattered and flying in the air.
I729|Shark 4|A view from below of a shark's underbelly with its mouth open exposing its teeth.
I112|Camping 10|A tent glowing from a light inside, pitched in a snow field with snow covered mountains in the background.
I394|Gazing 6|A young girl sitting in front of dandelions and blowing one in her hands.  Some pieces are in the air and some left to blow.  She has long blond hair and wears a hat.
I812|Sunset 3|Sunset with a red sky and a a few white clouds reflecting on a lake with dark trees in he background.
I93|Boxing 1|A Marine Corps woman boxer landing a punch on an Army woman boxer's face.
I757|Skydiving 3|Four skydivers free falling over a mountainous coastline.
I519|Neutral face 1|A white-haired man with a white beard engaging with someone.
I883|Wedding 10|A bride putting a wedding ring on the finger of the groom.  She is holding his hand with her other hand and is wearing a white bracelet.
I676|Rollercoaster 2|People with their hands raised on two roller coasters that are about to descend.
I449|Keyboard 3|A laptop with the keyboard keys lit and the screen showing an indistinct image.
I333|Fireman 1|A deputy fire chief standing in front of a smouldering heap and pointing to something with his left hand.
I105|Camping 2|A group of young students in a classroom on their knees with their hands folded.
I273|Dog 23|A black and white dog sticking his muzzle out between the bars of an enclosure.
I201|Dancing 3|Boys participating in a ritual dance holding spears and dressed in tribal grass clothing in front of a hut.
I422|Hang gliding 1|A hang glider taking off from the side of a mountain with a town below.
I573|Nude woman 10|A blond hair woman lying on the bed with her breasts as the focus.  She has a pink bra with black tie and a pink underwear with black garter.
I686|Rugby 2|Men playing rugby on a grassy field.  There are trees with purple leaves and old buildings in the background.
I714|Scary face 1|A person with his eyes closed and mouth open in a scream.
I540|Nude couple 14|A nude man and a woman performing oral sex on a bed with white sheets and pillows. The woman is kneeling on him, licking his penis with her butt in front of his face.  The man  has his legs spread wide and has his right hand on the woman's right leg and butt.  The both have tattoos.
I809|Sunflower 1|A field of sunflowers with a closeup  of five flowers. In the background there are trees and mountains.
I152|Cheerleader 2|A cheerleader with pompoms with her head tilted to one side.
I401|Grass 3|Tall green grass with drops of dew all over.
I294|Excited face 3|Two happy young boys smiling, one has blond hair and blue eyes, the other has brown hair and eyes.
I115|Car 2|Vintage Borgward car in blue and yellow color, rusty with a a Rio de Janeiro license plate.  The car has leaves on the hood and is parked in nature with trees in the background and leaves on the floor.
I660|Rainbow 1|A rainbow arch of green, yellow and orange over a blue calm ocean and the sky in the background.
I285|Drink 1|A glass of red wine a quarter full on a blue table with the background out of focus.
I636|Plane crash 1|A man standing on the wing of the dismantled carcass of an airplane.
I114|Car 1|A red and black supercar with its front wheels turned to the right.
I278|Dog 28|A dog lying on its back on a couch looking towards the viewer.
I402|Grass 4|A field of green tall grass.
I717|School 2|School children smiling and waving at the camera.
I446|Jail 5|Two rows of barbed wire fencing surrounding a prisoner barracks.
I604|Parachuting 1|A paraglider with the colorful chute deployed with a blue sky and scattered white clouds in the background.
I805|Street 3|A two way road with mountains in the background, a double yellow line in the middle and white lines on each side.  The blue sky has some white clouds.
I722|School 7|Two students hunched over a desk and working on a problem together while other students work in the background.
I511|Mother 7|A mother in a white dress and hat holding up a baby at her face level and saying something to the baby.
I688|Sad face 1|A sad baby crying with a tear running down the face.  He has big bue eyes and the mouth of the baby is half open.
I456|Lake 2|A lake surrounded by green trees and mountains on one side with a clear blue sky and a few clouds above.
I564|Nude woman 1|A woman with wet hair and nude torso in front of white tiles and a towel bar behind her.
I107|Camping 4|A man and a boy playing a board game at a camping site on a tabletop supported by logs tied together.
I875|Wedding 2|A bride wearing a white dress hold the groom's hand and a white bouquet of flowers in the other hand.
I150|Cemetery 5|A woman weeping over the stone of a buried person in a cemetery  She is putting her hand on the stone and bending over.
I638|Plane crash 3|The interior of a passenger aircraft in a semi-dismantled state.
I119|Car accident 4|A black car with its roof crushed in and extensive damage to the front and sides.
I654|Rafting 2|Rafters tipping over while navigating a stretch of white water.
I385|Garbage dump 7|Collection of glass recycled bottles and jars.
I784|Soldiers 3|A soldier in combat uniform carrying a rifle walking with four young children dressed in bright clothes.
I749|Sidewalk 6|Small white and blue stones in soil.
I316|Fence 6|A garden fence with a rose bush, a lawn and a house behind it.
I814|Sunset 5|A vivid sunset casting red and orange shades on the clouds above with the sun going down behind the rocks and water.
I570|Nude woman 7|Two women in bra tops with painted nails and heavy make up sitting next to each other.
I154|Child labor 2|Young boys working in a factory
I513|Mother 9|A woman sitting on a couch behind a baby in a baby seat balanced on a device.
I459|Lake 5|A lone tree on the shore of a blue lake surrounded by low clouds and mountains.
I462|Lake 8|A dock on an still and peacful alpine lake surrounded by coniferous trees.
