id,image_file,caption
I675|Rollercoaster 1|A crowd of people in a red roller coaster car going down a slope.  One rider has his arms raised over his head.
I679|Roofing 2|Copper covered tiles on a roof or sloped plane.
I677|Rollercoaster 3|A yellow roller coaster full of people, coasting on a red rail.
I712|Scared face 4|A man covering his mouth with his hand. His eyes are wide in an expression of shock.
I852|Tornado 5|A thick column of a tornado approaching under a cloudy sky.
I854|Traffic 1|Night time traffic patterns on a divided highway.
I884|Wedding 11|A bouquet of flowers with a white ribbon lying on gray stone steps.
I857|Volcano 2|A smoking crater with a grey plume of smoke below a white cloud.
I880|Wedding 7|A ring tied with red and white ribbons lying on a small pink pillow.
I640|Police 1|Policemen wearing helmets and body armor lined up in front of a building.
I838|Tiger 2|A  large orange and black  tiger looking straight with its mouth open and the tongue showing.
I888|Wolf 1|A wolf sitting in a snow back licking its lips behind an enclosure.
I866|War 3|A black and white photo of a man in a camouflage uniform holding an assault rifle.
I893|Yarn 3|Four bobbins of orange thread lined up in a row.
I823|Swimming 1|A swimmer in a pool between lane markers turning her head to take a breath while swimming.
I889|Wolf 2|A wolf baring its fangs in a menacing manner.
I821|Surprise 1|Water being splashed on a bespectacled woman who has her eyes screwed shut.
I885|Wedding 12|A row of chairs and tables set up for a meal with red napkins and inverted water glasses.
I841|Timber 3|A pile of wood logs.
I859|Wall 1|Brown and grey blemishes on the wall of a house.
I824|Swingset 1|A metallic swing hung with chains next to the trunk of a tree.
I881|Wedding 8|Miniature bride and groom figurines on a wedding cake
I848|Tornado 1|The dark column of a tornado approaching a road with a vehicle on it.
I900|Zebra 1|Two white and black zebras in an arid area standing next to each other with one kissing the other on the face.
I894|Yarn 4|A spool of white thread on a green, white and yellow fabric.
I827|Thunderstorm 3|Lightning striking the water behind an airport with several military helicopters.
I830|Thunderstorm 6|Lightning striking the sea behind an aircraft carrier with several aircraft on its deck.
I813|Sunset 4|A body of water in front of some mountains, with a sunset in the sky above reflecting onto the water.
I3|Acorns 3|Five acorns arranged in a circle on a black background. Slightly wilted leaves are next to the acorns.
I748|Sidewalk 5|White, grey, and blue paving stones arranged in arcs.
I837|Tiger 1|A tiger with its mouth open.  It is lying down and has a chain around its neck.
I891|Yarn 1|A black and white photo of three spools of thread.  Two are upright and one is lying on its side.
I798|Stingray 2|An orange and dark blue ray in light blue water.
I669|Rocks 2|Different sizes and shades of grey rocks with smooth edges.
I647|Present 1|A green present wrapped in blue ribbon, a purple present wrapper in lavender ribbon, and a pink present with white dots wrapped in a pink ribbon.
I1|Acorns 1|Two acorns are lying on the ground next to some oak leaves.
I890|Woods 1|Two tree trunks and five rocks in the foreground, with more trees in the background partially obscured by smoke.
I858|Volcano 3|A volcano with smoke rising out of it, behind a green field and trees.
I228|Destruction 5|A dirty American flag and white shoe, lying in broken wood with plants growing through it.
I782|Soldiers 1|A line of soldiers silhouetted against a sunset background, standing in front of an airplane.
I872|Waterfall 1|A black and white image of a large waterfall, with the lights of a city behind it.
I887|Windmill 1|A modern windmill.
I204|Dancing 6|A group of hula dancers in green floral dresses with green and yellow leis around their necks.  They have garlands around their heads, wrists, and ankles.
I808|Sun 1|A closeup image of the sun, with stars and space visible in the top left hand corner.
I822|Surprise 2|A happy child with wide open mouth holding a toy cell phone to his right ear.   The child has black hair with fringes with big brown eyes, a yellow and white shirt.
I397|Goat 2|A white goat standing on hay and green grass, with its head low to the ground.
I840|Timber 2|Cut logs with the bark still attached, stacked on top of each other.
I853|Torture chamber 1|Torture tools, including a rack, cuffs,and chains. There is also a sword and some helmets in the background.
I874|Wedding 1|A man in a black striped tuxedo and white dress shirt, placing a wedding ring on a woman's hand.
I295|Excited face 4|A chef whose mouth is open, wearing a white paper hat and blue shirt with an embroidered star on the lapel
I865|War 2|A group of soldiers standing behind artillery which has just been fired. Smoke is shooting out of the artillery and the shell is visible just above the barrel.
I834|Thunderstorm 10|A lightning bolt striking the ground behind some trees.
I867|War 4|A group of soldiers running through sandy terrain carrying rifles.
I806|Street 4|A two-lane road with a solid line on the left and a broken line on the right to divide it. Dirt and trees are on the side of the road.
I826|Thunderstorm 2|An image of cloudy skies, with blue lightning coming from the sky and striking towards a tree below.
I804|Street 2|A straight two-lane road passing through brown treeless hills with patches of snow on them.
I868|War 5|Soldiers wading ashore from landing craft at Normandy.
I864|War 1|A black and white photo of a boy aiming a pistol.
I839|Timber 1|A pile of wood fills the bottom half of the image, with blue skies in the top half. White and grey clouds are in the blue sky.
I844|Toilet 1|two urinals side by side on a white tile wall.  A thin partition divides them. There is a rectangular flushing button above each.
I825|Thunderstorm 1|Dark clouds and a rainstorm threatening a town.
I847|Toilet 4|A toilet in a partially demolished bathroom with graffiti on the lid and the tank.
I761|Skyscraper 2|High-rise buildings with floor-to-ceiling windows next to a river. One of the buildings has a red elevator that runs down to the river.
I544|Nude man 5|Four shirtless men in black pants smiling. One of them men has his phone in his waistband. Two of the men are tattooed.
I259|Dog 9|A medium sized black and brown dog with stubby ears and a greying muzzle that is standing on a gravel and mulch bed.
I702|Sad pose 6|An old woman wearing a red scarf, with her hand held against her face. The background is very blurry - a house with grass in front of it.
I132|Cat 3|A black and white photograph of a kitten with a person touching its nose with his finger.
I56|BDSM 1|A group of people with bondage tools and clothing while a larger crowd looks on.  One woman's breasts are bare, another holds a whip.  A man who is smiling holds a whip.
I816|Surgery 1|A surgeon making an incision in the belly of a female animal with light brown fur.
I472|Lamb 1|A lamb with short fleece, running on green grass.
I528|Nude couple 2|A dark haired man wearing glasses and a white collared shirt, kissing a dark haired woman wearing a white tank top.
I534|Nude couple 8|A dark-skinned woman with a sheet wrapped around her, being caressed by a light-skinned man wearing a silver watch, in a bed with white sheets.
I730|Shark 5|A shark swimming in front of a reef, with its teeth showing. The front half of the shark is visible.
I464|Lake 10|A brown pier with low wooden guards on the side, in a body of water with large mountains in the background and a yellow sky.
I453|Knife 1|A black and white photo of a folding knife, pointing into a table at an angle, with silver circles on its black handle.
I166|Cockroach 1|A cockroach flipped upside down, lying on a red floor with rocks embedded in it.
I829|Thunderstorm 5|Purple lightning in a purple sky, causing a lens flare in the top right of the image.
I553|Nude man 14|Three shirtless men, looking at something to the left of the image. A black woman is videotaping them in the background.
I514|Motocross 1|A BMX motorcycle jumping through the air over a brown and green background.  The rider is wearing black and white motorcycle gear.
I103|Bungee jumping 3|A smiling woman wearing an orange top and blue shorts, held by a bungee jumping apparatus, suspended over water and trees.
I429|Happy pose 2|Young men and women wearing suits and dresses, carrying red and yellow balloons and looking up.
I672|Rocks 5|Different shades of grey rocks with smooth edges.
I545|Nude man 6|A shirtless man wearing green shorts talking to a shirtless man wearing blue shorts, standing in front of the water on a beach.
I663|Road 1|A green car with a person's legs sticking out the window, sitting in the middle of a road with trees on both sides.
I102|Bungee jumping 2|A falling man attached to a bungee jumping apparatus.  He is wearing a white shirt and black sunglasses.
I419|Gun 9|A black rifle with a scope attached, lying next to a camouflage pattern rifle bag.
I476|Lightning 3|Lightning with many branches in a purple sky over a city on the water.
I474|Lightning 1|Yellow lightning hitting the water between two large dark rock formations.  The lightning and rocks are reflected in the water.
I585|Nude woman 22|A topless blonde woman kneeling on a red couch.  Her leg is tattooed above the ankle.
I703|Sad pose 7|A black and white drawing of a man holding a wounded woman, with a gun lying next to them.
I10|Alcohol 7|A bar with several bottles of wine and a partially-filled wine glass on it.  Three shelves full of bottles are in the background.
I298|Excited face 7|A freckled boy with braces on his teeth.  He is wearing a red helmet with a grate across the face.
I876|Wedding 3|The hands of a man and woman.  The woman is placing a silver wedding band on the man's finger.   She wears a matching wedding band and a bracelet.
I877|Wedding 4|A three-tiered cake, with pink and yellow frosting on it, and purple, pink, and yellow flowers. Blue plates are next to it.
I434|Horse 1|Two nuzzling horses, one with a white and brown head and brown mane, the other with a brown head and blonde main, in a grassy field.
I457|Lake 3|A two-story house with a balcony on the second floor and shutters on the windows.  A sloping field is behind it and a pond that reflects the house is in front of it.
I499|Money 1|Stacks of gold-colored pound coins, with the amount in each stack increasing from left to right.
I621|Picnic 2|Two girls both biting the same piece of watermelon.  They are sitting on a blue blanket in a grass field.
I750|Skier 1|A composite time-lapse image of a skier in white pants and a red jacket jumping off a snowy ramp.
I184|Couple 2|A man and a woman with their arms around each other, sitting on a white bench in front of a large house. The man is carrying a bouquet of flowers.
I818|Surgery 3|Surgeons and a nurse wearing masks and gowns, with blood on their gowns and gloved hands. A patient is on an operating table behind them. The surgeons are turned away, selecting tools to use.
I743|Siblings 1|A young girl lying next to an infant on a piece of fabric with flower and leaf patterns on it.  Both of them are wearing white clothes.
I28|Archery 1|A man in a flannel shirt and brown hat shooting an arrow from a bow.
I4|Alcohol 1|Two cocktails are on a brown wooden table.  The cocktail in front is white and one behind it is brown.  Two napkins with a logo on them are under the cocktails.
I83|Bloody knife 2|A serrated knife blade, pushing into someone's hand, with a bright red liquid on the blade.
I215|Depressed pose 3|A black and white photo of a woman sitting on the ground with one hand over her face and the other on top of her head.
I231|Destruction 8|A wrecked red Corvette, surrounded by broken wood and other trash. Gatorade and water bottles sit on a black table in front of it
I9|Alcohol 6|Two rows of rose and red wine bottles, lying in wood racks
I11|Alcohol 8|Two glasses of champagne and a bread and cheese plate, outdoors in front of a body of water and a pier.
I101|Bungee jumping 1|A man in free fall attached to a blue bungee jumping apparatus.  A river and mountain are below him.  He is wearing a white shirt and blue pants.
I637|Plane crash 2|A wreck of an airplane with the cockpit caved in, sitting in black dirt.
I683|Rooster 1|Four roosters with brown and black feathers, with two looking straight forward and two looking sideways.
I229|Destruction 6|A group of women looking at a destroyed brick building, standing in front of a destroyed fence post and a pile of rubble.
I796|Statue 2|A greenish rock with eyes, a nose, and a smile carved into it.
I325|Fire 8|A line of people who are blowing fire out of their mouths.
I357|Food 4|A table with roasted meat, sausages, bell peppers pickles and cucumbers.  There are two unopened bottles of beer on the table.
I725|Severed finger 1|A hand with a severed finger, in a plastic glove. The severed finger is bloody and wrapped in black material.
I873|Weapon 1|A gun battery on a boat, firing. There is a muzzle flash and blue water can be seen behind it.
I365|Frustrated pose 4|A black and white picture of a man with a beard and dark hair, wearing a white collared shirt and pressing a hand to his forehead.
I323|Fire 6|A roaring fire, with timber silhouetted in the bottom of it and red embers visible among the timber.
I673|Rocks 6|Different shades of grey rocks with sharp edges.
I554|Nude man 15|Three shirtless men in their underwear, standing in a blue room. One of the men is black, the other two are white.
I713|Scared face 5|A black and white photo of a woman with her eyes wide, lying in a bed and holding a white sheet over half her face.
I57|BDSM 2|Three women and two men with bondage gear walk down the street as a crowd looks on.   One woman carries a whip.  Another has bare breasts with a leather bodice supported by chains.
I428|Happy pose 1|A man in sandals, shorts, and a white shirt, jumping with his hands above his head and his legs pulled behind him over a brown field. In the background, mountains can be seen.
I792|Soup 1|A woman holding a white cup with a red liquid in it. Her nails are painted turquoise.
I527|Nude couple 1|A shirtless man with dark hair holding a woman and pressing his face against her back.
I546|Nude man 7|A man showering outside in front of a green tree.
I505|Mother 1|A silhouette of a woman holding a child above her head, with a yellow sky and water behind her.
I897|Yoga 3|A woman standing on one leg on a beach, with two boats in front of her in the water and smoke rising in the distance.
I77|Bird 4|A green bird with an orange beak, looking at a pink, purple, and blue bird with a black beak. Behind them is a chain link fence and a tree.
I601|Paperclips 2|Green, white, red, yellow, pink, black, and blue paperclips in a large pile.
I177|Cold 7|A leafless tree, covered in snow. The ground below the tree is also covered in snow, and tracks can be seen to the right of the tree.
I762|Sleepy pose 1|A sleeping girl with blonde hair lying on a white sheet.
I709|Scared face 1|A man is peering over a shelf and grasping it with his hands.
I55|Barrels 1|Four barrels.  One is brown, two are grey, and one is a darker brown.
I615|Penguins 1|A large group of penguins stands in an ice field.  Water and ice cliffs are in the background.
I199|Dancing 1|A man doing a cartwheel in a grass field.   He is wearing sneakers and a t-shirt.  The photo has been taken with a wide-angle lens.  It is black and white, except for the sky, which is dark blue.
I207|Dancing 9|Six women dancing, wearing large silver and red headdresses and bright yellow dresses. They are holding their hands on their hips.
I301|Exercise 3|Two groups of men rowing in black rubber rafts with green oars.  They are wearing camouflage pants.
I261|Dog 11|A brown dog sitting on a garden path.  His mouth is open and his mottled tongue is hanging out.  He has a chain collar around his neck.
I145|Celebration 2|A man in a hat holding five lit torches in front of water with other people standing behind him.  All appear in silhouette.
I504|Moon 1|A picture of the full moon against a dark background.  Maria and craters are visible on its surface.
I441|Intensity 1|A red-faced woman with brown hair, baring her teeth angrily.
I430|Happy pose 3|A boat sailing towards a bridge, on which four people are jumping into the air. A lens flare is behind the people.
I763|Sleepy pose 2|A sleeping guard, wearing a blue uniform, a tie, and a hat with an insignia on the front of it.
I171|Cold 1|A large ship with smoke rising from its funnel, followed by a smaller two-masted ship.  They are surrounded by sea ice.
I436|House 1|A house with an ornately carved stone doorway.  The wall on one side is decorated with tiles.  The window bars and lamp post are wrought iron.
I845|Toilet 2|Three white urinals with silver detectors above them, in a bathroom with brown tiled floor and cream tiled walls.
I850|Tornado 3|A tornado in the distance.  A house with a green roof and a tree are in the foreground.
I878|Wedding 5|A black and white photo of a man's hand underneath a woman's hand. The woman is wearing a silver bracelet, long white gloves, and a wedding dress. She is holding two wedding rings.
I14|Ambulance 3|An ambulance, a helicopter, and a fire truck are in a flat paved area. Several firemen are walking around.
I12|Ambulance 1|A man driving a motorcycle with a sidecar stretcher containing an injured man with a white bandage around his head. In the background, a row of men are standing next to horses.
I431|Heart 1|A heart-shaped keyhole on a brown wood surface.  It is held in place by three screws.
I831|Thunderstorm 7|Lightning in a mostly dark sky, with a large white spot in the center where the lightning originates.
I360|Football player 1|A football player is carrying the ball, while a player on the ground tries to pull him down by tugging on the sleeve of his jersey with both hands.
I461|Lake 7|A glassy body of water with grey rocks in it, and pine trees in the background. Behind the pine trees, snowy mountains can be seen.
I44|Bar 1|A bar with beer taps.  A glass of dark beer with a shot of whiskey beside it are on the bar. Two rows of liquor bottles are on shelves in back.
I790|Soldiers 9|A soldier wearing camouflage and carrying a gun stands on a pile of rocks.  A military vehicle is in the background.
I836|Tickling 1|A boy wearing a blue shirt, laughing as another person tickles him.
I851|Tornado 4|A tornado is moving across a flat field.  A black cloud of dirt surrounds its base.  At the top of the funnel is a large dark cloud.
I355|Food 2|A large platter of various kinds of sushi, with more sushi in the background.
I692|Sad face 5|The head and bare shoulders of a young girl.  She is looking to her right and is wearing earrings.
I144|Celebration 1|Five hockey players embrace in a tight circle.  They have their arms on each other's backs and hold their sticks pointing upwards.
I213|Depressed pose 1|A black and white photo of a man in a plaid shirt holding his head in his hands.
I237|Dirt 2|An unpaved road that goes through a field towards some mountains in the distance.
I690|Sad face 3|The face of a man with blue eyes, a large nose and a worried look on his face.
I89|Bored pose 4|A man sitting on a chair with his head tilted back and his eyes open gazing at something above.
I311|Fence 1|A chain link fence just in front of a yellow wall on which it is casting shadows.
I684|Rubber duck 1|A giant rubber duck floating on a lake with a very tall building visible in the background
I380|Garbage dump 2|Many bottles and other litter lying on the sand at a beach, with the water visible behind them.
I15|Angry face 1|A haggard looking black man in a dirty t-shirt and knit cap with glasses perched on top of his head.
I178|Cold 8|Two snowmen with carrot noses and eyes in a snowy field.
I344|Flowers 1|Green, red, pink, white, and yellow flowers above a black stone surface.
I418|Gun 8|A man in a black jacket wearing a gold wedding ring, opening a shotgun with a wooden handle and exposing two shells.
I86|Bored pose 1|A boy leans against a wall in a roughly finished room in front of window.  The wall next to the window has artwork drawn on it.
I536|Nude couple 10|A blonde haired woman in a white top, with a man lying down next to her with his head in her lap.
I470|Lake 16|Sunrise with a lake in the foreground from which the mists are rising as the sun's rays shine through the trees around the lake.
I46|Bar 3|Rows of liquor bottles with pouring spouts
I639|Plane crash 4|A single-engine plane lies upside-down near some trees.  Its landing gear is twisted and the wing in the foreground is broken.
I36|Baby 5|A baby girl is on all fours at a beach.  She is wearing a white dress with red trim.
I359|Food 6|Several skewers are on a grill.  They contain bell peppers, onions, and meat.
I47|Barbeque 1|Two hands holding a glass of beer and skewers with grilled okra on them.  A man in a yellow hat is removing a piece of okra from the skewers.
I691|Sad face 4|A black and white photo of an old man with  bushy eyebrows, wearing a collared sweater.
I738|Shot 1|Hands wearing gloves inserting a needle into a bump on a person's arm.
I318|Fire 1|A man breathing fire from his mouth.  He wears a turban and several necklaces.
I32|Baby 1|An infant grasps an adult finger in his hand.
I421|Hallway 1|A stone passage with two black pipes running along it, supported on stone posts.  There are filled-in window openings with X's marked above them.  The floor appears wet.
I248|Doctor 7|A surgeon operates on a draped patient, assisted by a nurse.  Various instruments are around the lower part of the patient's body and an imaging device is over his exposed skin.
I671|Rocks 4|Rounded wet stones of various sizes and colors.
I91|Bored pose 6|A child looks out a rain-covered window with his head resting on his hand.
I230|Destruction 7|A tree with garbage hanging off it, in front of a wooden structure that has been destroyed and is also covered in garbage. A blue car is in the background.
I529|Nude couple 3|A woman wearing a pink shirt kissing a man wearing a green short sleeved shirt.
I186|Couple 4|A man and woman embracing at the water's edge on a beach. The woman is leaning backwards while the man supports her.   She is wearing a white wedding dress and veil.  The man is wearing a black suit.
I232|Destruction 9|A destroyed house in which the roof has fallen down onto the rest of the house.  Across the yard, an American flag is tied to a post on top of a brick structure.
I739|Shot 2|A medic wearing camouflage smiles as he administers an injection to a black haired woman wincing in pain.
I764|Sleepy pose 3|A man with his head lying on the keyboard of a laptop computer.  His eyes are closed and he appears to be asleep.  A mouse with a red roller ball is next to him.
I538|Nude couple 12|A woman sitting astride a clothed man with her dress hiked up and her legs visible.   Out-of-focus city lights are in the background
I13|Ambulance 2|An ambulance and an emergency doctor's car are on the side of a road.  Both vehicles are white with orange stripes.  A yellow helicopter is on the ground behind a tree in the background.
I66|Beach 8|Many boats in the water in front of a beach.  People are standing on the beach and several chairs are on it.  A palm tree is in the foreground.  The sun is low in the sky.
I562|Nude man 22|The unclothed torso of a muscular man with his hands reaching up and his face turned up so that only his neck and chin are visible.
I444|Jail 3|A red barber chair with white arm rests in a decaying building with stone walls. Debris is around it.
I195|Cups 1|Two brown mugs with white insides.  One of them is lying on its side.
I531|Nude couple 5|An unclothed man and woman embracing in an intimate manner.
I855|Tumor 1|An old women with her left eye pulled open by two sets of fingers, revealing raw-looking red flesh where the eyeball used to be.
I94|Boxing 2|Two boxers fighting under bright lights.  They are wearing black gloves with red tape on the wrists.
I104|Camping 1|A man kneeling in front of a tent with two similar-looking girls at his sides.  Their hands rest on his shoulder, one on top of the other.
I43|Band 2|A black man with a beard and dreadlocks, standing at a microphone and holding a guitar.
I18|Angry face 4|A closeup of a man's face with squinting eyes and black and white stubble growing.  His expression looks angry.
I19|Angry face 5|A man with a beard and mustache looking sternly at the camera. Half of his face is obscured in darkness while the other half is lit by a red light.
I892|Yarn 2|A wooden spool of brown thread, lying on its side on a wood surface.
I302|Explosion 1|An airplane on a runway with an enormous red and orange explosion behind it.
I485|Lion 5|A lion and a cub looking up from the carcass of an animal that they have partially devoured.
I501|Monkey 2|An ape with black fur and its legs spread apart sitting in a rocky area.
I707|Satellite 1|The Soyuz spacecraft orbiting above the earth.
I742|Shot 5|A turquoise syringe with an orange cap, lying on top of healthcare paperwork with silver scissors in the background.
I525|Neutral pose 2|A man and dog walking on a snow-covered sidewalk past trees and bushes.
I148|Cemetery 3|A large array of white crosses with some stars of David at a military cemetery.
I306|Explosion 5|An enormous mushroom cloud rises from Bikini Atoll.
I99|Building 1|Three stained-glass windows depicting scenes from the life of Christ.
I189|Couple 7|A young man and woman embracing at the entrance of a wooden building.  The woman is barefoot, with her shoes visible to the left.  She wears a blue dress and a headband.  The man has on a blue shirt and dark pants.
I236|Destruction 3|A trash pile with wheels and axle parts from a machine or vehicle
